{
  "meeting_id": "MTG-CASE-05-03",
  "project_id": "PJT-CASE-05",
  "manager_id": "MGR-CASE-05",
  "dimension_findings": [
    {
      "dimension": "协同调度力",
      "finding_type": "strength",
      "summary": "管理者在群聊中对关键风险、依赖和变更进行了主动同步和澄清，形成了明确的责任方和下一步动作，体现了有效的跨角色协同调度。",
      "evidence_refs": [
        {
          "source_type": "chat",
          "source_file": "02_chats/im_messages_search_user.json",
          "source_id": "om_case05msg0034",
          "timestamp": "2026-04-23 11:25",
          "excerpt": "已经让法务在看了，初步判断有规避空间，但需要调整底部轮廓线。",
          "evidence_note": "针对竞品专利风险（风险ID: NO.603），管理者周牧主动同步了法务的评估进展和后续设计调整要求，明确了责任方（法务）和下一步动作（调整底部轮廓线）。"
        },
        {
          "source_type": "chat",
          "source_file": "02_chats/im_messages_search_user.json",
          "source_id": "om_case05msg0007",
          "timestamp": "2026-04-02 14:05",
          "excerpt": "我和声学团队确认一下，如果影响比较大就调整散热孔位置。",
          "evidence_note": "针对散热孔与音质的依赖冲突，管理者周牧主动澄清了责任方（自己）和下一步动作（与声学团队确认并可能调整位置），形成了明确的解决路径。"
        },
        {
          "source_type": "chat",
          "source_file": "02_chats/im_messages_search_user.json",
          "source_id": "om_case05msg0027",
          "timestamp": "2026-04-21 09:22",
          "excerpt": "是安全认证部门上周发的变更通知，我已经同步到项目文档里了。",
          "evidence_note": "针对智能门锁防水等级变更（风险ID: NO.602），管理者周牧确认了变更来源（安全认证部门）并告知了同步动作（已更新项目文档），完成了对关键范围变化的必要干系人同步。"
        }
      ],
      "confidence": 0.9,
      "risk_tags": [],
      "suggested_actions": []
    },
    {
      "dimension": "协同调度力",
      "finding_type": "risk",
      "summary": "针对高风险供应链阻塞（产能饱和），管理者选择脱离主要沟通群进行单独协调，但未在群内同步明确的解决路径或进展，可能影响其他干系人对风险状态的感知。",
      "evidence_refs": [
        {
          "source_type": "chat",
          "source_file": "02_chats/im_messages_search_user.json",
          "source_id": "om_case05msg0038",
          "timestamp": "2026-04-24 09:12",
          "excerpt": "先不在群里说了，我单独找供应链总监协调，看看能不能插队。",
          "evidence_note": "针对核心供应商产能饱和风险（风险ID: NO.604），管理者周牧决定脱离群聊进行单独协调，但未在群内形成被相关方确认的解决路径。后续群聊中（om_case05msg0048）仅提及‘还在沟通’，缺乏明确进展同步。"
        },
        {
          "source_type": "chat",
          "source_file": "02_chats/im_messages_search_user.json",
          "source_id": "om_case05msg0048",
          "timestamp": "2026-04-29 10:15",
          "excerpt": "还在沟通，总监说需要高层会议决策。",
          "evidence_note": "这是对供应链协调进展的询问（om_case05msg0047）的回应。回应表明协调仍在进行中且依赖高层决策，但未形成明确的下一步计划或时间点，阻塞未解除且解决路径不清晰。"
        }
      ],
      "confidence": 0.8,
      "risk_tags": [
        "风险同步不足",
        "解决路径不明确"
      ],
      "suggested_actions": [
        "建议在决定单独协调高风险事项后，仍在主要项目沟通渠道定期同步关键进展、遇到的障碍及下一步计划，确保必要干系人（如项目核心成员）对风险状态有基本了解。"
      ]
    },
    {
      "dimension": "协同调度力",
      "finding_type": "observation",
      "summary": "日历事件覆盖了项目核心干系人，且管理者在聊天中高频同步项目信息，为协同调度提供了良好的沟通基础。",
      "evidence_refs": [
        {
          "source_type": "hard_metrics",
          "source_file": "N/A",
          "source_id": "calendar_stakeholder_coverage_rate",
          "timestamp": "2026-01-01 ~ 2026-04-24",
          "excerpt": "value = 1, calculation.expression = 3 / 3",
          "evidence_note": "硬指标：calendar_stakeholder_coverage_rate。指标ID: calendar_stakeholder_coverage_rate, formula: value = calendar_events_with_required_stakeholders / total_calendar_events, calculation.expression: 3 / 3, value: 1。表明所有日历事件均覆盖了必要的项目干系人。"
        },
        {
          "source_type": "hard_metrics",
          "source_file": "N/A",
          "source_id": "manager_chat_signal_count",
          "timestamp": "2026-01-01 ~ 2026-04-24",
          "excerpt": "value = 25, calculation.expression = 25",
          "evidence_note": "硬指标：manager_chat_signal_count。指标ID: manager_chat_signal_count, formula: value = manager_chat_messages_count, calculation.expression: 25, value: 25。表明管理者周牧在评估周期内发出了25条聊天消息，占样本总数（50条）的一半，展现了较高的沟通活跃度。"
        }
      ],
      "confidence": 0.95,
      "risk_tags": [],
      "suggested_actions": []
    }
  ],
  "human_review_items": [
    {
      "review_id": "HRV-MTG-CASE-05-03-COORD-01",
      "reason": "需要复核管理者‘单独找供应链总监协调’这一决策的背景和考量。该决策使高风险阻塞（供应商产能饱和）的协调过程脱离了主要项目沟通群。需判断这是否是基于信息敏感性或沟通效率的合理选择，以及是否有其他替代的同步机制（如小范围同步会或定向更新）来平衡信息透明与沟通效率。",
      "severity": "medium",
      "related_dimension": "协同调度力",
      "evidence_refs": [
        {
          "source_type": "chat",
          "source_file": "02_chats/im_messages_search_user.json",
          "source_id": "om_case05msg0038",
          "timestamp": "2026-04-24 09:12",
          "excerpt": "先不在群里说了，我单独找供应链总监协调，看看能不能插队。",
          "evidence_note": "管理者明确表示将脱离群聊进行高风险事项的协调。"
        },
        {
          "source_type": "risk",
          "source_file": "coordination_context.risks",
          "source_id": "NO.604",
          "timestamp": "MTG-CASE-05-03",
          "excerpt": "核心注塑供应商Q2产能饱和，模具排期可能延后10天",
          "evidence_note": "此风险等级为‘medium’，触发原因为‘供应商订单过载，备选供应商精度不达标’，对项目里程碑（模具T0节点）有潜在重大影响。"
        }
      ]
    }
  ],
  "coordination_summary": "管理者周牧在协同调度方面展现出较强的主动性，能有效同步关键风险、澄清依赖并推动任务。日历覆盖和聊天活跃度指标良好。主要风险点在于处理高风险供应链阻塞时，选择了脱离主沟通渠道的单独协调方式，且后续进展同步不足，可能影响团队对关键风险状态的共同认知，建议复核该决策的合理性并关注后续同步机制。"
}