{
  "meeting_id": "MTG-CASE-05-03",
  "project_id": "PJT-CASE-05",
  "manager_id": "MGR-CASE-05",
  "dimension_findings": [
    {
      "dimension": "协同调度力",
      "finding_type": "strength",
      "summary": "管理者在群聊中主动同步关键信息、澄清依赖并指派任务，形成有效协同。",
      "evidence_refs": [
        {
          "source_type": "chat",
          "source_file": "02_chats/im_messages_search_user.json",
          "source_id": "om_case05msg0002",
          "timestamp": "2026-04-01 09:15",
          "excerpt": "4月项目启动，本周重点是完成智能音箱和扫地机器人的概念设计评审。",
          "evidence_note": "管理者周牧主动同步项目关键里程碑（概念设计评审）及本周重点。"
        },
        {
          "source_type": "chat",
          "source_file": "02_chats/im_messages_search_user.json",
          "source_id": "om_case05msg0007",
          "timestamp": "2026-04-02 14:05",
          "excerpt": "我和声学团队确认一下，如果影响比较大就调整散热孔位置。",
          "evidence_note": "针对结构工程师提出的散热孔与音质冲突问题，周牧明确责任方（自己）和下一步动作（与声学团队确认并调整）。"
        },
        {
          "source_type": "chat",
          "source_file": "02_chats/im_messages_search_user.json",
          "source_id": "om_case05msg0017",
          "timestamp": "2026-04-07 15:10",
          "excerpt": "收到，赵雪你跟进一下CMF调整。",
          "evidence_note": "在收到品牌颜色方案调整的需求后，周牧明确指派任务给具体负责人（赵雪）。"
        }
      ],
      "confidence": 0.9,
      "risk_tags": [],
      "suggested_actions": []
    },
    {
      "dimension": "协同调度力",
      "finding_type": "strength",
      "summary": "关键风险（专利侵权、供应商产能）在群聊中被识别并同步，管理者主动介入处理，形成解决路径。",
      "evidence_refs": [
        {
          "source_type": "chat",
          "source_file": "02_chats/im_messages_search_user.json",
          "source_id": "om_case05msg0033",
          "timestamp": "2026-04-23 11:20",
          "excerpt": "竞品上周发布的新品外观和我们扫地机器人的方案很像，要不要评估专利风险？",
          "evidence_note": "品牌经理张悦在群聊中主动识别并同步知识产权风险。"
        },
        {
          "source_type": "chat",
          "source_file": "02_chats/im_messages_search_user.json",
          "source_id": "om_case05msg0034",
          "timestamp": "2026-04-23 11:25",
          "excerpt": "已经让法务在看了，初步判断有规避空间，但需要调整底部轮廓线。",
          "evidence_note": "管理者周牧同步风险升级处理状态（已交法务评估），并明确了后续动作方向（调整底部轮廓线）。"
        },
        {
          "source_type": "chat",
          "source_file": "02_chats/im_messages_search_user.json",
          "source_id": "om_case05msg0035",
          "timestamp": "2026-04-24 09:00",
          "excerpt": "核心注塑供应商Q2订单饱和，我们的模具排期可能要延后。",
          "evidence_note": "供应链经理林峰在群聊中同步供应链产能瓶颈风险。"
        },
        {
          "source_type": "chat",
          "source_file": "02_chats/im_messages_search_user.json",
          "source_id": "om_case05msg0038",
          "timestamp": "2026-04-24 09:12",
          "excerpt": "先不在群里说了，我单独找供应链总监协调，看看能不能插队。",
          "evidence_note": "管理者周牧针对供应链阻塞风险，主动承担协调责任，并明确了升级路径（单独找供应链总监协调）。"
        }
      ],
      "confidence": 0.9,
      "risk_tags": [],
      "suggested_actions": []
    },
    {
      "dimension": "协同调度力",
      "finding_type": "observation",
      "summary": "跨角色响应多为有效响应，包含信息确认、问题澄清或任务承接，而非简单“收到”。",
      "evidence_refs": [
        {
          "source_type": "chat",
          "source_file": "02_chats/im_messages_search_user.json",
          "source_id": "om_case05msg0005",
          "timestamp": "2026-04-01 10:35",
          "excerpt": "收到，我调整一下底部轮廓线，增加差异化。",
          "evidence_note": "周牧对专利风险提醒的响应，包含具体行动（调整轮廓线）。"
        },
        {
          "source_type": "chat",
          "source_file": "02_chats/im_messages_search_user.json",
          "source_id": "om_case05msg0010",
          "timestamp": "2026-04-03 09:10",
          "excerpt": "主要是工艺，我们要求的曲面精度太高，需要五轴加工。",
          "evidence_note": "林峰对成本超支问题的澄清，提供了具体原因（工艺要求高）。"
        },
        {
          "source_type": "chat",
          "source_file": "02_chats/im_messages_search_user.json",
          "source_id": "om_case05msg0018",
          "timestamp": "2026-04-07 15:15",
          "excerpt": "好的，我本周内输出一版新方案。",
          "evidence_note": "赵雪对任务指派的响应，包含明确的交付承诺（本周内输出）。"
        }
      ],
      "confidence": 0.8,
      "risk_tags": [],
      "suggested_actions": []
    }
  ],
  "human_review_items": [
    {
      "review_id": "HRV-MTG-CASE-05-03-01",
      "reason": "需要复核管理者（周牧）在‘供应链风险应急沟通’会议（MTG-CASE-05-03）中，关于‘协调供应链总监争取插队’和‘同步评估供应商C打样能力’的决策，是否在会后有效同步给了项目核心干系人（如品牌、结构、CMF等），而不仅仅是与供应链经理（林峰）的两人沟通。当前证据仅显示两人会议和群聊中的初步表态。",
      "severity": "medium",
      "related_dimension": "协同调度力",
      "evidence_refs": [
        {
          "source_type": "calendar",
          "source_file": "06_calendar/calendar_events_instance_view.json",
          "source_id": "cal_case05_evt_0424_emergency",
          "timestamp": "2026-04-24T09:00:00+08:00",
          "excerpt": "供应链风险应急沟通 attendees=周牧,林峰",
          "evidence_note": "应急会议仅两人参加。"
        },
        {
          "source_type": "chat",
          "source_file": "02_chats/im_messages_search_user.json",
          "source_id": "om_case05msg0038",
          "timestamp": "2026-04-24 09:12",
          "excerpt": "先不在群里说了，我单独找供应链总监协调，看看能不能插队。",
          "evidence_note": "管理者决定单独协调，未在群聊中同步后续进展。"
        },
        {
          "source_type": "base_record",
          "source_file": "04_meetings/base_meetings_record_list.json",
          "source_id": "MTG-CASE-05-03",
          "timestamp": "2026-04-24 09:00 - 09:45",
          "excerpt": "供应链风险应急沟通",
          "evidence_note": "会议决策包含‘协调供应链总监争取插队’和‘同步评估供应商C打样能力’。"
        }
      ]
    }
  ],
  "coordination_summary": "在本次评估周期内，管理者周牧在协同调度方面展现出较强主动性。他频繁在群聊中同步关键里程碑（如项目启动、设计冻结）、澄清技术依赖（如散热孔与音质冲突）并明确任务指派。对于识别的重大风险（专利侵权、供应商产能瓶颈），能及时响应并形成明确的解决路径（如启动法务评估、计划升级协调）。跨角色聊天响应多为有效响应，包含具体行动或信息澄清。硬指标‘日历必要干系人覆盖率’为1，表明日历事件覆盖了关键协作者。需人工复核的一点是，针对‘供应链风险应急沟通’会议产生的关键决策和行动，是否在会后有效同步给了更广泛的项目核心干系人，以确保风险应对信息的透明度和协同一致性。"
}