{
  "meeting_id": "MTG-CASE-05-01",
  "project_id": "PJT-CASE-05",
  "manager_id": "MGR-CASE-05",
  "dimension_findings": [
    {
      "dimension": "协同调度力",
      "finding_type": "strength",
      "summary": "管理者能有效发起跨角色澄清，并形成明确的下一步动作。",
      "evidence_refs": [
        {
          "source_type": "chat",
          "source_file": "02_chats/im_messages_search_user.json",
          "source_id": "om_case05msg0009",
          "timestamp": "2026-04-03 09:05",
          "excerpt": "高在哪里？是材料还是工艺？",
          "evidence_note": "管理者周牧在收到供应商报价超预算信息后，立即追问具体原因，澄清依赖细节。"
        },
        {
          "source_type": "chat",
          "source_file": "02_chats/im_messages_search_user.json",
          "source_id": "om_case05msg0012",
          "timestamp": "2026-04-03 09:20",
          "excerpt": "我评估一下，看看能不能在保证效果的前提下简化曲面。",
          "evidence_note": "管理者周牧在澄清问题后，明确了责任方（自己）和下一步动作（评估设计简化）。"
        }
      ],
      "confidence": 0.9,
      "risk_tags": [],
      "suggested_actions": []
    },
    {
      "dimension": "协同调度力",
      "finding_type": "strength",
      "summary": "关键里程碑（外观冻结）在会议中被明确同步给必要干系人。",
      "evidence_refs": [
        {
          "source_type": "chat",
          "source_file": "02_chats/im_messages_search_user.json",
          "source_id": "om_case05msg0025",
          "timestamp": "2026-04-21 09:15",
          "excerpt": "本周重点：智能音箱和扫地机器人的外观必须冻结，不能再改了。",
          "evidence_note": "管理者周牧在群聊中明确同步了外观冻结的关键节点要求。"
        },
        {
          "source_type": "hard_metrics",
          "source_file": "hard_metrics_result",
          "source_id": "calendar_stakeholder_coverage_rate",
          "timestamp": "2026-01-01 ~ 2026-04-21",
          "excerpt": "value = 1, calculation.expression = \"3 / 3\"",
          "evidence_note": "metric_id: calendar_stakeholder_coverage_rate, formula: value = calendar_events_with_required_stakeholders / total_calendar_events, calculation.expression: 3 / 3, value: 1。表明关键会议（如V1.5迭代同步会）覆盖了所有必要干系人。"
        }
      ],
      "confidence": 0.85,
      "risk_tags": [],
      "suggested_actions": []
    },
    {
      "dimension": "协同调度力",
      "finding_type": "risk",
      "summary": "关键风险（成本上升15%）的同步路径不明确，可能未覆盖所有必要干系人（如财务）。",
      "evidence_refs": [
        {
          "source_type": "chat",
          "source_file": "02_chats/im_messages_search_user.json",
          "source_id": "om_case05msg0032",
          "timestamp": "2026-04-22 14:05",
          "excerpt": "先不要纠结成本，保证设计效果优先，预算问题我单独找财务沟通。",
          "evidence_note": "管理者周牧提及将单独与财务沟通成本上升问题，但未在群聊或会议纪要中明确该风险已同步给财务部门，也未提供后续确认。"
        },
        {
          "source_type": "current_meeting",
          "source_file": "provided_input",
          "source_id": "MTG-CASE-05-01",
          "timestamp": "2026-04-21 09:15 - 10:30",
          "excerpt": "成本上升15%由设计效果优先覆盖",
          "evidence_note": "会议决策记录了成本上升问题，但未明确记录该决策或风险已同步给预算审批方（如财务）。"
        }
      ],
      "confidence": 0.75,
      "risk_tags": [
        "风险同步不完整"
      ],
      "suggested_actions": [
        "建议在后续会议或沟通中，明确记录成本类风险同步给财务等预算干系人的动作和反馈。"
      ]
    },
    {
      "dimension": "协同调度力",
      "finding_type": "observation",
      "summary": "管理者主动处理跨团队阻塞（散热孔与音质冲突），并形成明确的解决路径。",
      "evidence_refs": [
        {
          "source_type": "chat",
          "source_file": "02_chats/im_messages_search_user.json",
          "source_id": "om_case05msg0007",
          "timestamp": "2026-04-02 14:05",
          "excerpt": "我和声学团队确认一下，如果影响比较大就调整散热孔位置。",
          "evidence_note": "管理者周牧在收到结构工程师关于散热孔影响音质的反馈后，主动提出与声学团队确认并明确了解决路径（调整位置）。"
        },
        {
          "source_type": "coordination_context",
          "source_file": "provided_input",
          "source_id": "NO.522",
          "timestamp": "Due: 2026-04-20",
          "excerpt": "task_name: \"声学团队散热孔位置确认\", status: \"已完成\", owner: \"周牧\"",
          "evidence_note": "任务列表显示该协调任务已由周牧完成，表明阻塞得到解决。"
        }
      ],
      "confidence": 0.8,
      "risk_tags": [],
      "suggested_actions": []
    }
  ],
  "human_review_items": [
    {
      "review_id": "HRV-CASE-05-COORD-01",
      "reason": "需要人工复核：关键风险（智能门锁防水等级变更）是否已由管理者有效同步给所有受影响的必要干系人（如结构、安全认证部门），并确认解决路径（密封圈+导流槽方案）已被相关方接受。",
      "severity": "medium",
      "related_dimension": "协同调度力",
      "evidence_refs": [
        {
          "source_type": "chat",
          "source_file": "02_chats/im_messages_search_user.json",
          "source_id": "om_case05msg0027",
          "timestamp": "2026-04-21 09:22",
          "excerpt": "是安全认证部门上周发的变更通知，我已经同步到项目文档里了。",
          "evidence_note": "管理者声称已将变更同步至文档，但需要复核该同步动作是否被结构、安全认证等关键干系人确认收到并理解。"
        },
        {
          "source_type": "coordination_context",
          "source_file": "provided_input",
          "source_id": "NO.602",
          "timestamp": "Triggered in MTG-CASE-05-01",
          "excerpt": "risk_description: \"智能门锁防水等级从IPX4提升至IPX6，外观开口需重新设计\", suggested_action: \"评估密封圈+导流槽组合方案，5月5日前输出新方案\"",
          "evidence_note": "风险记录显示有明确的解决建议，但需要复核该方案是否已得到结构工程师（陈立）等执行方的正式确认。"
        },
        {
          "source_type": "chat",
          "source_file": "02_chats/im_messages_search_user.json",
          "source_id": "om_case05msg0050",
          "timestamp": "2026-04-30 09:30",
          "excerpt": "密封圈+导流槽的方案看起来可行，但需要验证实际防水效果。",
          "evidence_note": "结构工程师陈立对新方案给出了技术反馈（需要验证），但未明确表示接受该方案作为解决路径，存在模糊性。"
        }
      ]
    }
  ],
  "coordination_summary": "管理者周牧在跨角色澄清、关键节点同步和处理技术阻塞方面表现出有效的协同调度能力。硬指标显示会议干系人覆盖完整。然而，对于成本上升风险和门锁防水变更风险，其同步给所有必要干系人（尤其是财务和结构部门）的完整性和确认度存在疑问，建议人工复核后者。"
}